"DESCRIPTION","DURATION IN MS","NAME","PARENT SUITE","START TIME","STATUS","STOP TIME","SUB SUITE","SUITE","TEST CLASS","TEST METHOD"
"","346","Empty fields show error message","Generated Tests","2026-04-14","passed","2026-04-14","","generated.spec.ts","",""
"","378","Invalid password shows error message","Generated Tests","2026-04-14","passed","2026-04-14","","generated.spec.ts","",""
"","380","Locked user shows locked user error","Generated Tests","2026-04-14","passed","2026-04-14","","generated.spec.ts","",""
"","504","Valid login navigates to Products page","Generated Tests","2026-04-14","passed","2026-04-14","","generated.spec.ts","",""
"","360","Invalid username shows error message","Generated Tests","2026-04-14","passed","2026-04-14","","generated.spec.ts","",""
